<?xml version="1.0" encoding="UTF-8"?>
<!DOCTYPE matrixE SYSTEM "ord15-16.dtd">

<matrixE>
<filaE><celdaE>1</celdaE><celdaE>0</celdaE><celdaE>2</celdaE></filaE>
<filaE><celdaE>3</celdaE><celdaE>1</celdaE><celdaE>5</celdaE></filaE>
<filaE><celdaE>0</celdaE><celdaE>1</celdaE><celdaE>2</celdaE></filaE>
</matrixE>
